{
  "schema": "self-improvement-proposal.v1",
  "proposalId": "openai-blog-building-frontend-uis-with-codex-and-figma-self-improvement",
  "createdAt": "2026-04-05T20:48:53.003Z",
  "sourceLane": "OpenAI Developers Blog",
  "sourceTier": "primary",
  "articleId": "building-frontend-uis-with-codex-and-figma",
  "title": "Building frontend UIs with Codex and Figma | OpenAI Developers",
  "sourceUrl": "https://developers.openai.com/blog/building-frontend-uis-with-codex-and-figma",
  "relevance": "high",
  "portability": "portable",
  "changeClass": "runtime_retrieval_hint",
  "target": "runtime/external-learning/runtime-retrieval",
  "objective": "Improve runtime retrieval targeting using article-specific guidance from Building frontend UIs with Codex and Figma | OpenAI Developers.",
  "evidence": {
    "summary": "Use Codex and Figma to bring real, running interfaces into Figma, refine them, and bring changes back to Codex.",
    "guidance": [
      "One of the core use cases of the Figma MCP server is retrieving context from Figma files and using that context in code generation. The Figma MCP server can capture information from Figma Design, Make, and FigJam files and pass it to Codex ",
      "The Figma MCP server can capture information from Figma Design, Make, and FigJam files and pass it to Codex as part of the building process.",
      "The Codex desktop application is purpose-built for agentic coding.",
      "Decide to either create a new Figma file or use an existing one.",
      "Starting today, you can generate Figma design files from Codex using the Figma MCP server.",
      "It provides a focused interface for managing multiple agents in parallel across projects, tracking progress without losing context, and integrating external tools."
    ],
    "topicTags": [
      "agents",
      "codex",
      "context",
      "frontend"
    ],
    "articleProposalId": "openai-blog-building-frontend-uis-with-codex-and-figma"
  },
  "candidateChange": {
    "runtimeRetrievalHint": {
      "hintId": "building-frontend-uis-with-codex-and-figma-runtime-retrieval",
      "appliesToAgents": [
        "default",
        "frontend_worker"
      ],
      "appliesToTaskFamilies": [
        "web_creative"
      ],
      "topics": [
        "agents",
        "codex",
        "context",
        "frontend"
      ],
      "lexicalTriggers": [
        "context",
        "planner",
        "generator",
        "evaluator"
      ],
      "preferredArticleIds": [
        "building-frontend-uis-with-codex-and-figma"
      ],
      "topicBoost": 3,
      "articleBoost": 8
    },
    "frontendQualityNote": {
      "noteId": "building-frontend-uis-with-codex-and-figma-frontend-quality",
      "appliesToAgents": [
        "default",
        "frontend_worker"
      ],
      "appliesToTaskFamilies": [
        "web_creative"
      ],
      "topics": [
        "agents",
        "codex",
        "context",
        "frontend"
      ],
      "lexicalTriggers": [
        "context",
        "planner",
        "generator",
        "evaluator"
      ],
      "preferredArticleIds": [
        "building-frontend-uis-with-codex-and-figma"
      ],
      "qualityAxes": [
        "responsive_quality"
      ],
      "guidance": [
        "One of the core use cases of the Figma MCP server is retrieving context from Figma files and using that context in code generation. The Figma MCP server can capture information from Figma Design, Make, and FigJam files a",
        "The Figma MCP server can capture information from Figma Design, Make, and FigJam files and pass it to Codex as part of the building process.",
        "The Codex desktop application is purpose-built for agentic coding."
      ]
    }
  },
  "promotion": {
    "decision": "auto_apply_candidate",
    "rationale": "bounded_low_risk_runtime_hint",
    "riskFlags": [
      "machine_gate_required"
    ]
  },
  "gate": {
    "required": true,
    "status": "pending",
    "caseIds": [
      "web_creative_benchmark",
      "frontend_context_iteration",
      "backend_non_targeted"
    ]
  }
}
