{
  "schema": "self-improvement-proposal.v1",
  "proposalId": "anthropic-engineering-infrastructure-noise-self-improvement",
  "createdAt": "2026-04-06T14:51:53.952Z",
  "sourceLane": "Anthropic Engineering",
  "sourceTier": "secondary",
  "articleId": "infrastructure-noise",
  "title": "Quantifying infrastructure noise in agentic coding evals",
  "sourceUrl": "https://www.anthropic.com/engineering/infrastructure-noise",
  "relevance": "high",
  "portability": "portable",
  "changeClass": "eval_extension",
  "target": "scripts/config/eval_suite_default.json",
  "objective": "Propose eval-strengthening guidance based on Quantifying infrastructure noise in agentic coding evals.",
  "evidence": {
    "summary": "Infrastructure configuration can swing agentic coding benchmarks by several percentage points—sometimes more than the leaderboard gap between top models.",
    "guidance": [
      "Agentic coding evals are different: models are given a full environment where they write programs, run tests, install dependencies, and iterate over multiple turns.",
      "Agentic coding benchmarks like SWE-bench and Terminal-Bench are commonly used to compare the software engineering capabilities of frontier models—with top spots on leaderboards often separated by just a few percentage points.",
      "Eval developers have begun accounting for this.",
      "Terminal-Bench 2.0, for instance, specifies recommended CPU and RAM on a per-task basis in their latest 2.0 release.",
      "We also tested whether this pattern holds on evals outside Terminal-Bench by running a crossover experiment on SWE-bench.",
      "This finding raised a larger question: how much does resource configuration impact evaluation scores?"
    ],
    "topicTags": [
      "agents",
      "evals"
    ],
    "articleProposalId": "anthropic-engineering-infrastructure-noise"
  },
  "candidateChange": {
    "note": "Infrastructure configuration can swing agentic coding benchmarks by several percentage points—sometimes more than the leaderboard gap between top models."
  },
  "promotion": {
    "decision": "proposal_only",
    "rationale": "governed_review_required",
    "riskFlags": [
      "governed_review_required"
    ]
  },
  "gate": {
    "required": false,
    "status": "not_applicable",
    "caseIds": [
      "web_creative_benchmark",
      "frontend_context_iteration",
      "backend_non_targeted"
    ]
  }
}
