{
  "schema": "self-improvement-proposal.v1",
  "proposalId": "anthropic-engineering-demystifying-evals-for-ai-agents-self-improvement",
  "createdAt": "2026-04-05T02:47:47.429Z",
  "sourceLane": "Anthropic Engineering",
  "sourceTier": "secondary",
  "articleId": "demystifying-evals-for-ai-agents",
  "title": "Demystifying evals for AI agents",
  "sourceUrl": "https://www.anthropic.com/engineering/demystifying-evals-for-ai-agents",
  "relevance": "high",
  "portability": "portable",
  "changeClass": "eval_extension",
  "target": "scripts/config/eval_suite_default.json",
  "objective": "Propose eval-strengthening guidance based on Demystifying evals for AI agents.",
  "evidence": {
    "summary": "The capabilities that make agents useful also make them difficult to evaluate. The strategies that work across deployments combine techniques to match the complexity of the systems they measure.",
    "guidance": [
      "As we described in Building effective agents , agents operate over many turns: calling tools, modifying state, and adapting based on intermediate results.",
      "Through our internal work and with customers at the frontier of agent development, we’ve learned how to design more rigorous and useful evals for agents.",
      "Good evaluations help teams ship AI agents more confidently.",
      "These same capabilities that make AI agents useful—autonomy, intelligence, and flexibility—also make them harder to evaluate.",
      "An evaluation (“eval”) is a test for an AI system: give an AI an input, then apply grading logic to its output to measure success. In this post, we focus on automated evals that can be run during development without real users.",
      "In this post, we focus on automated evals that can be run during development without real users."
    ],
    "topicTags": [
      "agents",
      "context",
      "evals",
      "frontend"
    ],
    "articleProposalId": "anthropic-engineering-demystifying-evals-for-ai-agents"
  },
  "candidateChange": {
    "frontendQualityNote": {
      "noteId": "demystifying-evals-for-ai-agents-frontend-quality",
      "appliesToAgents": [
        "default",
        "frontend_worker"
      ],
      "appliesToTaskFamilies": [
        "web_creative"
      ],
      "topics": [
        "agents",
        "context",
        "evals",
        "frontend"
      ],
      "lexicalTriggers": [
        "planner",
        "generator",
        "evaluator",
        "subagent"
      ],
      "preferredArticleIds": [
        "demystifying-evals-for-ai-agents"
      ],
      "qualityAxes": [
        "frontend_quality"
      ],
      "guidance": [
        "As we described in Building effective agents , agents operate over many turns: calling tools, modifying state, and adapting based on intermediate results.",
        "Through our internal work and with customers at the frontier of agent development, we’ve learned how to design more rigorous and useful evals for agents.",
        "Good evaluations help teams ship AI agents more confidently."
      ]
    }
  },
  "promotion": {
    "decision": "proposal_only",
    "rationale": "governed_review_required",
    "riskFlags": [
      "governed_review_required"
    ]
  },
  "gate": {
    "required": false,
    "status": "not_applicable",
    "caseIds": [
      "web_creative_benchmark",
      "frontend_context_iteration",
      "backend_non_targeted"
    ]
  }
}
