{
  "schema": "self-improvement-proposal.v1",
  "proposalId": "openai-blog-run-long-horizon-tasks-with-codex-self-improvement",
  "createdAt": "2026-04-03T23:30:47.228Z",
  "sourceLane": "OpenAI Developers Blog",
  "sourceTier": "primary",
  "articleId": "run-long-horizon-tasks-with-codex",
  "title": "Run long horizon tasks with Codex | OpenAI Developers",
  "sourceUrl": "https://developers.openai.com/blog/run-long-horizon-tasks-with-codex",
  "relevance": "high",
  "portability": "portable",
  "changeClass": "runtime_retrieval_hint",
  "target": "runtime/external-learning/runtime-retrieval",
  "objective": "Improve runtime retrieval targeting using article-specific guidance from Run long horizon tasks with Codex | OpenAI Developers.",
  "evidence": {
    "summary": "This was an experiment, not a production rollout. But it performed well on the parts that matter for long-horizon work: following the spec, staying on task, running verification, and repairing failures as it went.",
    "guidance": [
      "These screenshots are useful because they make the core shift visible: agentic coding is increasingly about time horizon, not just one-shot intelligence.",
      "Section focus: Takeaways for long-horizon Codex tasks",
      "Section focus: Why Codex can stay coherent on long tasks",
      "This is not only “models got smarter.” The practical change is that agents can stay coherent for longer, complete larger chunks of work end-to-end, and recover from errors without losing the thread.",
      "This was an experiment, not a production rollout. But it performed well on the parts that matter for long-horizon work: following the spec, staying on task, running verification, and repairing failures as it went.",
      "In December 2025, we launched 5.2 which was the moment that people began to believe that using autonomous coding agents could be reliable."
    ],
    "topicTags": [
      "agents",
      "automation",
      "codex",
      "context",
      "evals",
      "frontend",
      "skills"
    ],
    "articleProposalId": "openai-blog-run-long-horizon-tasks-with-codex"
  },
  "candidateChange": {
    "runtimeRetrievalHint": {
      "hintId": "run-long-horizon-tasks-with-codex-runtime-retrieval",
      "appliesToAgents": [
        "default",
        "frontend_worker"
      ],
      "appliesToTaskFamilies": [
        "web_creative"
      ],
      "topics": [
        "agents",
        "automation",
        "codex",
        "context"
      ],
      "lexicalTriggers": [
        "long horizon",
        "planner",
        "generator",
        "evaluator"
      ],
      "preferredArticleIds": [
        "run-long-horizon-tasks-with-codex"
      ],
      "topicBoost": 3,
      "articleBoost": 8
    },
    "frontendQualityNote": {
      "noteId": "run-long-horizon-tasks-with-codex-frontend-quality",
      "appliesToAgents": [
        "default",
        "frontend_worker"
      ],
      "appliesToTaskFamilies": [
        "web_creative"
      ],
      "topics": [
        "agents",
        "automation",
        "codex",
        "context"
      ],
      "lexicalTriggers": [
        "long horizon",
        "planner",
        "generator",
        "evaluator"
      ],
      "preferredArticleIds": [
        "run-long-horizon-tasks-with-codex"
      ],
      "qualityAxes": [
        "frontend_quality"
      ],
      "guidance": [
        "These screenshots are useful because they make the core shift visible: agentic coding is increasingly about time horizon, not just one-shot intelligence.",
        "Section focus: Takeaways for long-horizon Codex tasks",
        "Section focus: Why Codex can stay coherent on long tasks"
      ]
    }
  },
  "promotion": {
    "decision": "auto_apply_candidate",
    "rationale": "bounded_low_risk_runtime_hint",
    "riskFlags": [
      "machine_gate_required"
    ]
  },
  "gate": {
    "required": true,
    "status": "pending",
    "caseIds": [
      "web_creative_benchmark",
      "frontend_context_iteration",
      "backend_non_targeted"
    ]
  }
}
