{
  "schema": "self-improvement-proposal.v1",
  "proposalId": "anthropic-engineering-harness-design-long-running-apps-self-improvement",
  "createdAt": "2026-04-04T17:23:27.031Z",
  "sourceLane": "Anthropic Engineering",
  "sourceTier": "secondary",
  "articleId": "harness-design-long-running-apps",
  "title": "Harness design for long-running application development",
  "sourceUrl": "https://www.anthropic.com/engineering/harness-design-long-running-apps",
  "relevance": "high",
  "portability": "portable",
  "changeClass": "eval_extension",
  "target": "scripts/config/eval_suite_default.json",
  "objective": "Propose eval-strengthening guidance based on Harness design for long-running application development.",
  "evidence": {
    "summary": "Harness design is key to performance at the frontier of agentic coding. Here's how we pushed Claude further in frontend design and long-running autonomous software engineering.",
    "guidance": [
      "We've previously shown that harness design has a substantial impact on the effectiveness of long running agentic coding.",
      "Two insights shaped the harness I built for frontend design.",
      "Design quality: Does the design feel like a coherent whole rather than a collection of parts? Strong work here means the colors, typography, layout, imagery, and other details combine to create a distinct mood and identity.",
      "For more complex tasks, the agent still tends to go off the rails over time.",
      "I started by experimenting on frontend design, where the self-evaluation issue was most visible."
    ],
    "topicTags": [
      "agents",
      "context",
      "evals",
      "frontend",
      "skills"
    ],
    "articleProposalId": "anthropic-engineering-harness-design-long-running-apps"
  },
  "candidateChange": {
    "frontendQualityNote": {
      "noteId": "harness-design-long-running-apps-frontend-quality",
      "appliesToAgents": [
        "default",
        "frontend_worker"
      ],
      "appliesToTaskFamilies": [
        "web_creative"
      ],
      "topics": [
        "agents",
        "context",
        "evals",
        "frontend"
      ],
      "lexicalTriggers": [
        "typography",
        "planner",
        "generator",
        "evaluator"
      ],
      "preferredArticleIds": [
        "harness-design-long-running-apps"
      ],
      "qualityAxes": [
        "typography",
        "hierarchy"
      ],
      "guidance": [
        "We've previously shown that harness design has a substantial impact on the effectiveness of long running agentic coding.",
        "Two insights shaped the harness I built for frontend design.",
        "Design quality: Does the design feel like a coherent whole rather than a collection of parts? Strong work here means the colors, typography, layout, imagery, and other details combine to create a distinct mood and identi"
      ]
    }
  },
  "promotion": {
    "decision": "proposal_only",
    "rationale": "governed_review_required",
    "riskFlags": [
      "governed_review_required"
    ]
  },
  "gate": {
    "required": false,
    "status": "not_applicable",
    "caseIds": [
      "web_creative_benchmark",
      "frontend_context_iteration",
      "backend_non_targeted"
    ]
  }
}
