{
  "schema": "self-improvement-proposal.v1",
  "proposalId": "anthropic-engineering-effective-harnesses-for-long-running-agents-self-improvement",
  "createdAt": "2026-04-05T09:15:52.146Z",
  "sourceLane": "Anthropic Engineering",
  "sourceTier": "secondary",
  "articleId": "effective-harnesses-for-long-running-agents",
  "title": "Effective harnesses for long-running agents",
  "sourceUrl": "https://www.anthropic.com/engineering/effective-harnesses-for-long-running-agents",
  "relevance": "high",
  "portability": "mixed",
  "changeClass": "frontend_quality_note",
  "target": "docs/FRONTEND_QUALITY_PLAYBOOK.md",
  "objective": "Propose frontend quality guidance based on Effective harnesses for long-running agents.",
  "evidence": {
    "summary": "Agents still face challenges working across many context windows. We looked to human engineers for inspiration in creating a more effective harness for long-running agents.",
    "guidance": [
      "The core challenge of long-running agents is that they must work in discrete sessions, and each new session begins with no memory of what came before.",
      "However, getting agents to make consistent progress across multiple context windows remains an open problem.",
      "As AI agents become more capable, developers are increasingly asking them to take on complex tasks requiring work that spans hours, or even days."
    ],
    "topicTags": [
      "agents",
      "context",
      "frontend"
    ],
    "articleProposalId": "anthropic-engineering-effective-harnesses-for-long-running-agents"
  },
  "candidateChange": {
    "frontendQualityNote": {
      "noteId": "effective-harnesses-for-long-running-agents-frontend-quality",
      "appliesToAgents": [
        "default",
        "frontend_worker"
      ],
      "appliesToTaskFamilies": [
        "web_creative"
      ],
      "topics": [
        "agents",
        "context",
        "frontend"
      ],
      "lexicalTriggers": [
        "context",
        "memory",
        "planner",
        "generator"
      ],
      "preferredArticleIds": [
        "effective-harnesses-for-long-running-agents"
      ],
      "qualityAxes": [
        "frontend_quality"
      ],
      "guidance": [
        "The core challenge of long-running agents is that they must work in discrete sessions, and each new session begins with no memory of what came before.",
        "However, getting agents to make consistent progress across multiple context windows remains an open problem.",
        "As AI agents become more capable, developers are increasingly asking them to take on complex tasks requiring work that spans hours, or even days."
      ]
    }
  },
  "promotion": {
    "decision": "auto_apply_candidate",
    "rationale": "bounded_low_risk_runtime_hint",
    "riskFlags": [
      "machine_gate_required"
    ]
  },
  "gate": {
    "required": true,
    "status": "pending",
    "caseIds": [
      "web_creative_benchmark",
      "frontend_context_iteration",
      "backend_non_targeted"
    ]
  }
}
