{
  "schema": "self-improvement-proposal.v1",
  "proposalId": "openai-blog-one-year-of-responses-self-improvement",
  "createdAt": "2026-04-04T01:08:19.569Z",
  "sourceLane": "OpenAI Developers Blog",
  "sourceTier": "primary",
  "articleId": "one-year-of-responses",
  "title": "From prompts to products: One year of Responses | OpenAI Developers",
  "sourceUrl": "https://developers.openai.com/blog/one-year-of-responses",
  "relevance": "high",
  "portability": "portable",
  "changeClass": "runtime_retrieval_hint",
  "target": "runtime/external-learning/runtime-retrieval",
  "objective": "Improve runtime retrieval targeting using article-specific guidance from From prompts to products: One year of Responses | OpenAI Developers.",
  "evidence": {
    "summary": "Five stories from developers building agentic products with the Responses API in its first year.",
    "guidance": [
      "Agent behavior monitoring",
      "One year ago, we introduced the Responses API — a foundation for developers and enterprises to build useful and reliable agents.",
      "Tracking behavior changes across agent versions",
      "Raindrop is the monitoring platform behind the world’s most ambitious AI companies to catch when their agents go off the rails in production.",
      "Failure detection and alerting",
      "As agents have gotten more complex, these failures have become more critical."
    ],
    "topicTags": [
      "agents",
      "api",
      "automation",
      "codex",
      "context",
      "evals",
      "frontend"
    ],
    "articleProposalId": "openai-blog-one-year-of-responses"
  },
  "candidateChange": {
    "runtimeRetrievalHint": {
      "hintId": "one-year-of-responses-runtime-retrieval",
      "appliesToAgents": [
        "default",
        "frontend_worker"
      ],
      "appliesToTaskFamilies": [
        "web_creative"
      ],
      "topics": [
        "agents",
        "automation",
        "codex",
        "context"
      ],
      "lexicalTriggers": [
        "planner",
        "generator",
        "evaluator",
        "subagent"
      ],
      "preferredArticleIds": [
        "one-year-of-responses"
      ],
      "topicBoost": 3,
      "articleBoost": 8
    },
    "frontendQualityNote": {
      "noteId": "one-year-of-responses-frontend-quality",
      "appliesToAgents": [
        "default",
        "frontend_worker"
      ],
      "appliesToTaskFamilies": [
        "web_creative"
      ],
      "topics": [
        "agents",
        "automation",
        "codex",
        "context"
      ],
      "lexicalTriggers": [
        "planner",
        "generator",
        "evaluator",
        "subagent"
      ],
      "preferredArticleIds": [
        "one-year-of-responses"
      ],
      "qualityAxes": [
        "frontend_quality"
      ],
      "guidance": [
        "Agent behavior monitoring",
        "One year ago, we introduced the Responses API — a foundation for developers and enterprises to build useful and reliable agents.",
        "Tracking behavior changes across agent versions"
      ]
    }
  },
  "promotion": {
    "decision": "auto_apply_candidate",
    "rationale": "bounded_low_risk_runtime_hint",
    "riskFlags": [
      "machine_gate_required"
    ]
  },
  "gate": {
    "required": true,
    "status": "pending",
    "caseIds": [
      "web_creative_benchmark",
      "frontend_context_iteration",
      "backend_non_targeted"
    ]
  }
}
